{
  "$schema": "http://json-schema.org/draft-07/schema#",
  "$id": "speakspec/constraint_extraction_v1.json",
  "title": "Stage 1 Constraint Extraction Output",
  "description": "Cleaned intent + structured constraints extracted from a spoken system description. Stage 1 of the Speakspec pipeline. Every field is required; emit null or empty array where a value is genuinely absent rather than omitting the key.",
  "type": "object",
  "additionalProperties": false,
  "required": [
    "intent_summary",
    "core_intent",
    "analogies",
    "named_components",
    "constraints",
    "open_questions",
    "interview_questions"
  ],
  "properties": {
    "intent_summary": {
      "type": "string",
      "description": "200-400 word cleaned restatement of what the developer wants to build, with filler, false starts, and tangents removed. Plain prose. No markdown headers.",
      "minLength": 200
    },
    "core_intent": {
      "type": "string",
      "description": "One sentence: the single thing this system is for.",
      "minLength": 10
    },
    "analogies": {
      "type": "array",
      "description": "Comparisons the speaker used ('like Notion but for X'). High-signal constraint indicators. Empty array if none.",
      "items": {
        "type": "object",
        "additionalProperties": false,
        "required": ["comparison", "implication"],
        "properties": {
          "comparison": { "type": "string", "description": "The analogy as spoken, e.g. 'like Stripe for healthcare'." },
          "implication": { "type": "string", "description": "What this analogy implies about the architecture." }
        }
      }
    },
    "named_components": {
      "type": "array",
      "description": "Specific systems, services, or parts the speaker explicitly named.",
      "items": { "type": "string" }
    },
    "constraints": {
      "type": "array",
      "description": "Exactly the constraint categories Speakspec tracks. Include every category that was stated OR can be reasonably inferred. Mark each with source.",
      "items": {
        "type": "object",
        "additionalProperties": false,
        "required": ["category", "value", "source", "confidence"],
        "properties": {
          "category": {
            "type": "string",
            "enum": [
              "deployment_target",
              "team_size",
              "latency_requirement",
              "scale_expectation",
              "ops_complexity_budget",
              "ship_timeline",
              "external_integrations",
              "language_preference",
              "persistence_requirements",
              "security_posture",
              "quality_goals"
            ]
          },
          "value": {
            "type": "string",
            "description": "The extracted constraint value. For language_preference, this MUST be null-equivalent ('none stated') unless the speaker explicitly named a language."
          },
          "source": {
            "type": "string",
            "enum": ["stated", "inferred"],
            "description": "'stated' = speaker said it explicitly. 'inferred' = derived from context. language_preference may ONLY be 'stated'; never infer a language preference."
          },
          "confidence": {
            "type": "string",
            "enum": ["high", "medium", "low"]
          }
        }
      }
    },
    "open_questions": {
      "type": "array",
      "description": "Things a senior architect would need answered that the speaker did not address. Drives the architecture's low-confidence flags downstream.",
      "items": { "type": "string" }
    },
    "interview_questions": {
      "type": "array",
      "description": "EXACTLY 2 to 4 clarifying questions, each specific to THIS system. Never generic. Never ask 'what language do you want'. Each must target a gap that materially changes the architecture.",
      "minItems": 2,
      "maxItems": 4,
      "items": {
        "type": "object",
        "additionalProperties": false,
        "required": ["question", "why_it_matters"],
        "properties": {
          "question": { "type": "string" },
          "why_it_matters": { "type": "string", "description": "Which architecture decision this answer would change." }
        }
      }
    }
  }
}
